{
  "android_apns": [
    {
      "apn": "Ufone.internet",
      "carrier_id": 1657,
      "name": "Ufone WAP",
      "types": [
        "default",
        "ia",
        "supl"
      ]
    },
    {
      "apn": "Ufone.internet",
      "name": "Ufone WAP",
      "types": [
        "default",
        "supl"
      ]
    },
    {
      "apn": "Ufone.mms",
      "carrier_id": 1657,
      "mmsc": "http://www.ufonemms.com:80/",
      "mmsport": 8080,
      "mmsproxy": "172.16.13.27",
      "name": "Ufone MMS",
      "types": [
        "mms"
      ]
    },
    {
      "apn": "Ufone.mms",
      "mmsc": "http://www.ufonemms.com:80/",
      "mmsport": 8080,
      "mmsproxy": "172.16.13.27",
      "name": "Ufone MMS",
      "types": [
        "mms"
      ]
    },
    {
      "apn": "ufone.internet",
      "name": "ufone.internet",
      "password": "ufone",
      "types": [
        "default",
        "supl"
      ],
      "user": "ufone"
    },
    {
      "apn": "ufone.internet",
      "name": "Ufone",
      "types": [
        "dun"
      ]
    },
    {
      "apn": "ufone.pinternet",
      "name": "ufone.pinternet",
      "types": [
        "default",
        "supl"
      ]
    }
  ],
  "android_carrier_config": {
    "carrier_default_wfc_ims_enabled_bool": true,
    "carrier_default_wfc_ims_mode_int": 2,
    "carrier_metered_apn_types_strings": [
      "default",
      "dun",
      "supl"
    ],
    "carrier_volte_available_bool": true,
    "carrier_vt_available_bool": true,
    "carrier_wfc_ims_available_bool": true,
    "enabledMMS": true,
    "maxMessageSize": 307200,
    "recipientLimit": 10
  },
  "capabilities": {
    "esim": "unknown",
    "ims_conference": "unknown",
    "mms": "supported",
    "rcs": "unknown",
    "sms_over_ims": "unknown",
    "video_calling": "supported",
    "volte": "supported",
    "vonr": "unknown",
    "vowifi": "supported",
    "wifi_calling_roaming": "unknown"
  },
  "display_name": "Carrier 41003",
  "match": {
    "mccmnc": [
      "41003"
    ]
  },
  "profile_id": "open.41003.5e2b8afa3e98",
  "schema_version": 1
}
