{
  "addons": {
    "emergency_calling": {
      "e911_routing_policy": "auto",
      "emergency_dial_call_style": "BlockLog,DisableMuteHold,NoWaitInSvcE911"
    },
    "network_policy": {
      "mobile_network_setting_menu_tokens": [
        "-preferrednetworkmode",
        "-cdmasystemselect",
        "-voltecall"
      ],
      "network_type_capability": "USC-USC-GLB-USA",
      "voice_network_setting_style": "NetworkSetting_USC"
    },
    "operator_display": {
      "indicator_icon_branding": "USC"
    }
  },
  "android_apns": [
    {
      "apn": "cdma",
      "mmsc": "http://mmsc1.uscc.net/mmsc/MMS",
      "name": "USC Test CDMA",
      "types": [
        "default",
        "mms"
      ]
    }
  ],
  "android_carrier_config": {
    "carrier_volte_available_bool": true
  },
  "capabilities": {
    "esim": "unknown",
    "ims_conference": "unknown",
    "mms": "supported",
    "rcs": "unknown",
    "sms_over_ims": "unknown",
    "video_calling": "unknown",
    "volte": "supported",
    "vonr": "unknown",
    "vowifi": "unknown",
    "wifi_calling_roaming": "unknown"
  },
  "display_name": "USC Test CDMA",
  "match": {
    "mccmnc": [
      "262800"
    ],
    "spn": [
      "USC Test CDMA"
    ]
  },
  "profile_id": "open.262800.c1c0acc89a82",
  "schema_version": 1
}
