{
  "android_carrier_config": {
    "carrier_vt_available_bool": false
  },
  "capabilities": {
    "esim": "unknown",
    "ims_conference": "unknown",
    "mms": "unknown",
    "rcs": "unknown",
    "sms_over_ims": "unknown",
    "video_calling": "unsupported",
    "volte": "unknown",
    "vonr": "unknown",
    "vowifi": "unknown",
    "wifi_calling_roaming": "unknown"
  },
  "display_name": "LineageOS 310160",
  "match": {
    "imsi_prefix_patterns": [
      "31026097"
    ],
    "mccmnc": [
      "310160"
    ]
  },
  "profile_id": "open.310160.db8926a5c124",
  "schema_version": 1
}
