{
  "android_carrier_config": {
    "carrier_use_ims_first_for_emergency_bool": false
  },
  "capabilities": {
    "esim": "unknown",
    "ims_conference": "unknown",
    "mms": "unknown",
    "rcs": "unknown",
    "sms_over_ims": "unknown",
    "video_calling": "unknown",
    "volte": "unknown",
    "vonr": "unknown",
    "vowifi": "unknown",
    "wifi_calling_roaming": "unknown"
  },
  "display_name": "Jazztel",
  "match": {
    "android_carrier_ids": [
      1974
    ],
    "mccmnc": [
      "21403",
      "21407"
    ],
    "spn": [
      "JAZZTEL",
      "Jazztel"
    ]
  },
  "profile_id": "open.21403.b0858f2be486",
  "schema_version": 1
}
