{
  "addons": {
    "emergency_calling": {
      "e911_routing_policy": "auto"
    },
    "ims": {
      "contacts_operator_style": "OPV",
      "support_ims_clir_overriding": true
    },
    "network_policy": {
      "display_antenna_limited": true,
      "gcf_sor": true,
      "mobile_network_setting_menu_tokens": [
        "-voltecall"
      ],
      "network_type_capability": "EUR-EUR-GSM-EUR",
      "voice_network_setting_style": "StopNetworkSearchingOnPause"
    },
    "operator_display": {
      "indicator_icon_branding": "ORANGE",
      "refer_eons_without_lac": true
    },
    "wifi_calling": {
      "operator_branding": "WiFi Calling",
      "operator_style_tokens": [
        "WFC_TITLE_FROM_CSC",
        "WFC_HELP_NOTI",
        "WFC_GPG",
        "WFC_OPL"
      ],
      "show_vowifi_end_call": true
    }
  },
  "android_apns": [
    {
      "apn": "hos",
      "name": "Orange SERVICES",
      "protocol": "IPV4V6",
      "types": [
        "xcap"
      ]
    },
    {
      "apn": "ims",
      "name": "Orange IMS",
      "protocol": "IPV6",
      "roaming_protocol": "IPV6",
      "types": [
        "ims"
      ]
    },
    {
      "apn": "internetipv6",
      "name": "Orange INTERNET",
      "protocol": "IPV6",
      "types": [
        "default"
      ]
    },
    {
      "apn": "mms",
      "mmsc": "http://mms.orange.pl",
      "mmsport": 8080,
      "mmsproxy": "192.168.6.104",
      "name": "Orange MMS",
      "types": [
        "mms"
      ]
    },
    {
      "apn": "hos",
      "authtype": 0,
      "carrier_enabled": true,
      "mvno_match_data": "Orange",
      "mvno_type": "spn",
      "name": "Orange SERVICES",
      "protocol": "IPV4V6",
      "types": [
        "xcap"
      ]
    },
    {
      "apn": "ims",
      "authtype": 0,
      "carrier_enabled": true,
      "mvno_match_data": "Orange",
      "mvno_type": "spn",
      "name": "Orange IMS",
      "protocol": "IPV6",
      "roaming_protocol": "IPV6",
      "types": [
        "ims"
      ]
    },
    {
      "apn": "internetipv6",
      "authtype": 0,
      "carrier_enabled": true,
      "mvno_match_data": "Orange",
      "mvno_type": "spn",
      "name": "Orange INTERNET",
      "password": "internet",
      "protocol": "IPV6",
      "types": [
        "default",
        "supl"
      ],
      "user": "internet"
    },
    {
      "apn": "mms",
      "authtype": 0,
      "carrier_enabled": true,
      "mmsc": "http://mms.orange.pl",
      "mmsport": 8080,
      "mmsproxy": "192.168.6.104",
      "mvno_match_data": "Orange",
      "mvno_type": "spn",
      "name": "Orange MMS",
      "password": "mms",
      "types": [
        "mms"
      ],
      "user": "mms"
    }
  ],
  "android_carrier_config": {
    "carrier_metered_apn_types_strings": [
      "default",
      "dun",
      "supl"
    ],
    "carrier_metered_roaming_apn_types_strings": [
      "default",
      "dun",
      "supl"
    ],
    "carrier_volte_available_bool": true,
    "carrier_wfc_ims_available_bool": true,
    "editable_wfc_mode_bool": false,
    "recipientLimit": 10,
    "wfc_data_spn_format_idx_int": 5,
    "wfc_spn_format_idx_int": 5
  },
  "capabilities": {
    "esim": "unknown",
    "ims_conference": "unknown",
    "mms": "supported",
    "rcs": "unknown",
    "sms_over_ims": "unknown",
    "video_calling": "unknown",
    "volte": "supported",
    "vonr": "unknown",
    "vowifi": "supported",
    "wifi_calling_roaming": "unknown"
  },
  "display_name": "Orange",
  "match": {
    "mccmnc": [
      "26003"
    ],
    "spn": [
      "Orange"
    ]
  },
  "profile_id": "open.26003.10882bf46617",
  "schema_version": 1
}
