{
  "android_apns": [
    {
      "apn": "hotspot",
      "name": "hotspot",
      "protocol": "IPV4V6",
      "roaming_protocol": "IPV4V6",
      "types": [
        "dun"
      ],
      "user_editable": false
    },
    {
      "apn": "ims",
      "bearer_bitmask": "3|9|10|11|14|15|18|20",
      "name": "IMS",
      "protocol": "IPV4V6",
      "roaming_protocol": "IPV4V6",
      "types": [
        "ims"
      ],
      "user_editable": false
    },
    {
      "apn": "internet",
      "name": "internet",
      "protocol": "IPV4V6",
      "roaming_protocol": "IPV4V6",
      "types": [
        "default",
        "supl"
      ],
      "user_editable": false
    },
    {
      "apn": "sos",
      "name": "SOS",
      "protocol": "IPV4V6",
      "roaming_protocol": "IPV4V6",
      "types": [
        "emergency"
      ],
      "user_editable": false
    },
    {
      "apn": "xcap",
      "mmsc": "http://mms.mnc340.mcc313.pub.3gppnetwork.org/mmsc",
      "name": "xcap",
      "protocol": "IPV4V6",
      "roaming_protocol": "IPV4V6",
      "types": [
        "mms",
        "xcap"
      ],
      "user_editable": false
    }
  ],
  "android_carrier_config": {
    "allow_hold_call_during_emergency_bool": false,
    "carrier_default_wfc_ims_roaming_enabled_bool": true,
    "carrier_metered_apn_types_strings": [
      "default",
      "dun",
      "supl"
    ],
    "carrier_metered_roaming_apn_types_strings": [
      "default",
      "dun",
      "supl"
    ],
    "carrier_supports_ss_over_ut_bool": true,
    "carrier_volte_available_bool": true,
    "carrier_wfc_ims_available_bool": true,
    "hide_enhanced_4g_lte_bool": true,
    "httpParams": "X-MDN: ##LINE1##",
    "imsvoice.conference_factory_uri_string": "n-way_voice@ims.mnc340.mcc313.3gppnetwork.org",
    "maxMessageSize": 1048576,
    "recipientLimit": 20,
    "rtt_supported_bool": true,
    "rtt_supported_while_roaming_bool": true,
    "wfc_spn_format_idx_int": 4
  },
  "capabilities": {
    "esim": "unknown",
    "ims_conference": "unknown",
    "mms": "supported",
    "rcs": "unknown",
    "sms_over_ims": "unknown",
    "video_calling": "unknown",
    "volte": "supported",
    "vonr": "unknown",
    "vowifi": "supported",
    "wifi_calling_roaming": "supported"
  },
  "display_name": "Dish5Gsa Us",
  "match": {
    "gid1_prefixes": [
      "7330"
    ],
    "mccmnc": [
      "313340"
    ]
  },
  "profile_id": "open.313340.9285297a7915",
  "schema_version": 1
}
