{
  "addons": {
    "ims": {
      "support_ims_clir_overriding": true
    },
    "network_policy": {
      "display_antenna_limited": true,
      "gcf_sor": true,
      "network_type_capability": "EUR-EUR-GSM-EUR"
    },
    "operator_display": {
      "five_g_icon_configuration": [
        "connected_mmwave:5G",
        "connected:5G",
        "not_restricted_rrc_idle:5G",
        "not_restricted_rrc_con:NONE"
      ],
      "refer_eons_without_lac": true
    }
  },
  "android_apns": [
    {
      "apn": "internet",
      "name": "internet",
      "types": [
        "default"
      ]
    }
  ],
  "android_carrier_config": {
    "carrier_volte_available_bool": true
  },
  "capabilities": {
    "esim": "unknown",
    "ims_conference": "unknown",
    "mms": "unknown",
    "rcs": "unknown",
    "sms_over_ims": "unknown",
    "video_calling": "unknown",
    "volte": "supported",
    "vonr": "unknown",
    "vowifi": "unknown",
    "wifi_calling_roaming": "unknown"
  },
  "display_name": "Orange ML",
  "match": {
    "mccmnc": [
      "61002"
    ],
    "spn": [
      "Orange ML"
    ]
  },
  "profile_id": "open.61002.41aaa8034b3f",
  "schema_version": 1
}
