{
  "android_apns": [
    {
      "apn": "hos",
      "name": "HOS",
      "protocol": "IPV4V6",
      "types": [
        "xcap"
      ],
      "user_visible": false
    },
    {
      "apn": "ims",
      "bearer_bitmask": "14|18|20",
      "name": "ims",
      "protocol": "IPV4V6",
      "roaming_protocol": "IPV4V6",
      "types": [
        "ims"
      ],
      "user_visible": false
    },
    {
      "apn": "internet.mobiel",
      "authtype": 1,
      "name": "Internet",
      "protocol": "IPV4V6",
      "types": [
        "default",
        "supl"
      ]
    }
  ],
  "android_carrier_config": {
    "carrier_default_wfc_ims_enabled_bool": true,
    "carrier_default_wfc_ims_mode_int": 1,
    "carrier_default_wfc_ims_roaming_mode_int": 1,
    "carrier_supports_ss_over_ut_bool": true,
    "carrier_volte_available_bool": true,
    "carrier_wfc_ims_available_bool": true,
    "editable_wfc_roaming_mode_bool": true,
    "hide_enhanced_4g_lte_bool": true,
    "ims_reasoninfo_mapping_string_array": [
      "361| call declined|1017",
      "510|Call completed elsewhere|1014"
    ],
    "iwlan.epdg_static_address_string": "epdg.epc.mnc016.mcc204.pub.3gppnetwork.org",
    "rtt_supported_bool": true,
    "rtt_supported_while_roaming_bool": true,
    "wfc_spn_format_idx_int": 1
  },
  "capabilities": {
    "esim": "unknown",
    "ims_conference": "unknown",
    "mms": "unknown",
    "rcs": "unknown",
    "sms_over_ims": "unknown",
    "video_calling": "unknown",
    "volte": "supported",
    "vonr": "unknown",
    "vowifi": "supported",
    "wifi_calling_roaming": "unknown"
  },
  "display_name": "Tmomvno Nl",
  "match": {
    "gid1_prefixes": [
      "2F"
    ],
    "mccmnc": [
      "20416"
    ]
  },
  "profile_id": "open.20416.768bfecf92e9",
  "schema_version": 1
}
