{
  "android_apns": [
    {
      "apn": "default",
      "name": "Moov",
      "types": [
        "default",
        "supl"
      ]
    }
  ],
  "capabilities": {
    "esim": "unknown",
    "ims_conference": "unknown",
    "mms": "unknown",
    "rcs": "unknown",
    "sms_over_ims": "unknown",
    "video_calling": "unknown",
    "volte": "unknown",
    "vonr": "unknown",
    "vowifi": "unknown",
    "wifi_calling_roaming": "unknown"
  },
  "display_name": "Carrier 62802",
  "match": {
    "mccmnc": [
      "62802"
    ]
  },
  "profile_id": "open.62802.6de9825f07d9",
  "schema_version": 1
}
