{
  "addons": {
    "ims": {
      "support_ims_clir_overriding": true
    },
    "network_policy": {
      "display_antenna_limited": true,
      "gcf_sor": true,
      "network_type_capability": "EUR-EUR-GSM-EUR"
    },
    "operator_display": {
      "five_g_icon_configuration": [
        "connected_mmwave:5G",
        "connected:5G",
        "not_restricted_rrc_idle:5G",
        "not_restricted_rrc_con:NONE"
      ],
      "refer_eons_without_lac": true
    }
  },
  "android_apns": [
    {
      "apn": "Internet",
      "name": "Internet",
      "types": [
        "default"
      ]
    },
    {
      "apn": "OoredooMMS",
      "mmsc": "http://10.10.111.1",
      "mmsport": 3128,
      "mmsproxy": "192.168.52.3",
      "name": "Ooredoo MMS",
      "types": [
        "mms"
      ]
    }
  ],
  "capabilities": {
    "esim": "unknown",
    "ims_conference": "unknown",
    "mms": "supported",
    "rcs": "unknown",
    "sms_over_ims": "unknown",
    "video_calling": "unknown",
    "volte": "unknown",
    "vonr": "unknown",
    "vowifi": "unknown",
    "wifi_calling_roaming": "unknown"
  },
  "display_name": "Ooredoo",
  "match": {
    "mccmnc": [
      "60303"
    ],
    "spn": [
      "Ooredoo"
    ]
  },
  "profile_id": "open.60303.f8b174613372",
  "schema_version": 1
}
