{
  "addons": {
    "emergency_calling": {
      "e911_routing_policy": "auto",
      "emergency_dial_call_style": "DisableMuteHold,BlockAddCall,CSRetry"
    },
    "network_policy": {
      "display_antenna_limited": true,
      "gcf_sor": true,
      "network_type_capability": "XAA-XAA-GLB-USA"
    },
    "operator_display": {
      "indicator_icon_branding": "XAA_OPEN"
    }
  },
  "android_apns": [
    {
      "apn": "mms.viya.vi",
      "mmsc": "http://mms.viyavi.com",
      "mmsport": 80,
      "mmsproxy": "65.172.54.73",
      "name": "Viya MMS",
      "protocol": "IPV4V6",
      "types": [
        "mms"
      ]
    },
    {
      "apn": "web.viya.vi",
      "name": "Viya",
      "protocol": "IPV4V6",
      "types": [
        "default"
      ]
    }
  ],
  "android_carrier_config": {
    "carrier_volte_available_bool": true
  },
  "capabilities": {
    "esim": "unknown",
    "ims_conference": "unknown",
    "mms": "supported",
    "rcs": "unknown",
    "sms_over_ims": "unknown",
    "video_calling": "unknown",
    "volte": "supported",
    "vonr": "unknown",
    "vowifi": "unknown",
    "wifi_calling_roaming": "unknown"
  },
  "display_name": "Viya",
  "match": {
    "mccmnc": [
      "311040"
    ],
    "spn": [
      "Viya"
    ]
  },
  "profile_id": "open.311040.ccaa7219c362",
  "schema_version": 1
}
