{
  "android_carrier_config": {
    "carrier_volte_available_bool": true,
    "carrier_vt_available_bool": true,
    "carrier_wfc_ims_available_bool": true,
    "imssms.sms_over_ims_supported_bool": true
  },
  "capabilities": {
    "esim": "unknown",
    "ims_conference": "unknown",
    "mms": "unknown",
    "rcs": "supported",
    "sms_over_ims": "supported",
    "video_calling": "supported",
    "volte": "supported",
    "vonr": "supported",
    "vowifi": "supported",
    "wifi_calling_roaming": "unknown"
  },
  "display_name": "ATT US GoogleGC",
  "match": {
    "gid1_prefixes": [
      "2AC9"
    ],
    "mccmnc": [
      "310280"
    ]
  },
  "profile_id": "open.310280.75874cd37179",
  "schema_version": 1
}
