{
  "addons": {
    "emergency_calling": {
      "e911_routing_policy": "auto",
      "emergency_dial_call_style": "EndPreviousCall"
    },
    "ims": {
      "support_ims_clir_overriding": true
    },
    "network_policy": {
      "display_antenna_limited": true,
      "gcf_sor": true,
      "mobile_network_setting_menu_tokens": [],
      "network_type_capability": "EUR-EUR-GSM-EUR",
      "voice_network_setting_style": "StopNetworkSearchingOnPause,GetPreferredNTModeForLteOnly"
    },
    "operator_display": {
      "five_g_icon_configuration": [
        "connected_mmwave:5G",
        "connected:5G",
        "not_restricted_rrc_idle:5G",
        "not_restricted_rrc_con:5G"
      ],
      "indicator_icon_branding": "INU_4G",
      "refer_eons_without_lac": true
    }
  },
  "android_apns": [
    {
      "apn": "bsnlmms",
      "mmsc": "http://bsnlmmsc.in",
      "mmsport": 8080,
      "mmsproxy": "10.210.10.11",
      "name": "CelloneNorth_mms",
      "protocol": "IPV4V6",
      "roaming_protocol": "IPV4V6",
      "types": [
        "mms"
      ]
    },
    {
      "apn": "bsnlnet",
      "name": "CelloneNorth_net",
      "protocol": "IPV4V6",
      "roaming_protocol": "IPV4V6",
      "types": [
        "default"
      ]
    },
    {
      "apn": "ims",
      "name": "IMS",
      "protocol": "IPV4V6",
      "roaming_protocol": "IPV4V6",
      "types": [
        "ims"
      ]
    }
  ],
  "android_carrier_config": {
    "carrier_volte_available_bool": true
  },
  "capabilities": {
    "esim": "unknown",
    "ims_conference": "unknown",
    "mms": "supported",
    "rcs": "unknown",
    "sms_over_ims": "unknown",
    "video_calling": "unknown",
    "volte": "supported",
    "vonr": "unknown",
    "vowifi": "unknown",
    "wifi_calling_roaming": "unknown"
  },
  "display_name": "Cellone_North",
  "match": {
    "mccmnc": [
      "40459"
    ],
    "spn": [
      "Cellone_North"
    ]
  },
  "profile_id": "open.40459.1c4fca308d06",
  "schema_version": 1
}
