{
  "addons": {
    "ims": {
      "support_ims_clir_overriding": true
    },
    "network_policy": {
      "display_antenna_limited": true,
      "gcf_sor": true,
      "network_type_capability": "EUR-EUR-GSM-EUR"
    },
    "operator_display": {
      "five_g_icon_branding": "5GAvailable",
      "five_g_icon_configuration": [
        "connected_mmwave:5G",
        "connected:5G",
        "not_restricted_rrc_idle:5G",
        "not_restricted_rrc_con:5G"
      ],
      "refer_eons_without_lac": true
    },
    "wifi_calling": {
      "show_vowifi_end_call": true
    }
  },
  "android_apns": [
    {
      "apn": "Internet",
      "name": "iD Internet",
      "types": [
        "default"
      ]
    },
    {
      "apn": "MMS",
      "mmsc": "http://mms/",
      "mmsport": 9028,
      "mmsproxy": "10.12.0.1",
      "name": "iD MMS",
      "types": [
        "mms"
      ]
    }
  ],
  "android_carrier_config": {
    "carrier_volte_available_bool": true,
    "smsToMmsTextThreshold": 10
  },
  "capabilities": {
    "esim": "unknown",
    "ims_conference": "unknown",
    "mms": "supported",
    "rcs": "unknown",
    "sms_over_ims": "unknown",
    "video_calling": "unknown",
    "volte": "supported",
    "vonr": "unknown",
    "vowifi": "unknown",
    "wifi_calling_roaming": "unknown"
  },
  "display_name": "iD Ireland",
  "match": {
    "mccmnc": [
      "27216"
    ],
    "spn": [
      "iD Ireland"
    ]
  },
  "profile_id": "open.27216.52d225604cde",
  "schema_version": 1
}
