{
  "addons": {
    "emergency_calling": {
      "e911_routing_policy": "auto"
    },
    "ims": {
      "support_ims_clir_overriding": true
    },
    "network_policy": {
      "display_antenna_limited": true,
      "gcf_sor": true,
      "mobile_network_setting_menu_tokens": [
        "-voltecall"
      ],
      "network_selection_menu_style": "NUMERIC",
      "network_type_capability": "EUR-EUR-GSM-EUR",
      "voice_network_setting_style": "SupportDualDataRoam"
    },
    "operator_display": {
      "five_g_icon_configuration": [
        "connected_mmwave:5G",
        "connected:5G",
        "not_restricted_rrc_idle:5G",
        "not_restricted_rrc_con:5G"
      ],
      "refer_eons_without_lac": true
    },
    "wifi_calling": {
      "operator_style_tokens": [
        "WFC_HELP_ADD_OSP",
        "WFC_HELP_NOTI",
        "WFC_GPG"
      ],
      "show_vowifi_end_call": true
    }
  },
  "android_apns": [
    {
      "apn": "airtelnet.es",
      "name": "INTERNET",
      "types": [
        "default"
      ]
    },
    {
      "apn": "airtelwap.es",
      "name": "airtelwap.es",
      "types": [
        "default"
      ]
    },
    {
      "apn": "ims",
      "name": "IMS",
      "protocol": "IPV4V6",
      "roaming_protocol": "IPV4V6",
      "types": [
        "ims"
      ]
    },
    {
      "apn": "mms.vodafone.net",
      "mmsc": "http://mmsc.vodafone.es/servlets/mms",
      "mmsport": 80,
      "mmsproxy": "212.73.32.10",
      "name": "MMS",
      "types": [
        "mms"
      ]
    },
    {
      "apn": "ut.es",
      "name": "ut.es",
      "types": [
        "xcap"
      ]
    }
  ],
  "android_carrier_config": {
    "carrier_volte_available_bool": true,
    "enabledMMS": false
  },
  "capabilities": {
    "esim": "unknown",
    "ims_conference": "unknown",
    "mms": "conditional",
    "rcs": "unknown",
    "sms_over_ims": "unknown",
    "video_calling": "unknown",
    "volte": "supported",
    "vonr": "unknown",
    "vowifi": "unknown",
    "wifi_calling_roaming": "unknown"
  },
  "display_name": "vodafone ES",
  "match": {
    "mccmnc": [
      "21401"
    ],
    "spn": [
      "vodafone ES"
    ]
  },
  "profile_id": "open.21401.089fd6feaed6",
  "schema_version": 1
}
