{
  "addons": {
    "ims": {
      "support_ims_clir_overriding": true
    },
    "network_policy": {
      "display_antenna_limited": true,
      "gcf_sor": true,
      "network_type_capability": "EUR-EUR-GSM-EUR"
    },
    "operator_display": {
      "five_g_icon_branding": "5GAvailable",
      "five_g_icon_configuration": [
        "connected_mmwave:5G",
        "connected:5G",
        "not_restricted_rrc_idle:5G",
        "not_restricted_rrc_con:5G"
      ],
      "refer_eons_without_lac": true
    },
    "wifi_calling": {
      "show_vowifi_end_call": true
    }
  },
  "android_apns": [
    {
      "apn": "ims",
      "name": "ims",
      "protocol": "IPV4V6",
      "roaming_protocol": "IPV4V6",
      "types": [
        "ims"
      ]
    },
    {
      "apn": "live.vodafone.com",
      "name": "live.vodafone.com",
      "protocol": "IPV4V6",
      "roaming_protocol": "IPV4V6",
      "types": [
        "default"
      ]
    },
    {
      "apn": "mms.vodafone.net",
      "mmsc": "http://www.vodafone.ie/mms",
      "mmsport": 80,
      "mmsproxy": "10.24.59.200",
      "name": "mms.vodafone.net",
      "protocol": "IPV4V6",
      "roaming_protocol": "IPV4V6",
      "types": [
        "mms"
      ]
    },
    {
      "apn": "xcap",
      "name": "xcap",
      "protocol": "IPV4V6",
      "roaming_protocol": "IPV4V6",
      "types": [
        "xcap"
      ]
    }
  ],
  "android_carrier_config": {
    "carrier_volte_available_bool": true,
    "smsToMmsTextThreshold": 10
  },
  "capabilities": {
    "esim": "unknown",
    "ims_conference": "unknown",
    "mms": "supported",
    "rcs": "unknown",
    "sms_over_ims": "unknown",
    "video_calling": "unknown",
    "volte": "supported",
    "vonr": "unknown",
    "vowifi": "unknown",
    "wifi_calling_roaming": "unknown"
  },
  "display_name": "Vodafone IE",
  "match": {
    "mccmnc": [
      "27201"
    ],
    "spn": [
      "Vodafone IE"
    ]
  },
  "profile_id": "open.27201.d7793db90063",
  "schema_version": 1
}
