{
  "android_carrier_config": {
    "carrier_metered_apn_types_strings": [
      "default",
      "dun",
      "mms",
      "supl"
    ]
  },
  "capabilities": {
    "esim": "unknown",
    "ims_conference": "unknown",
    "mms": "unknown",
    "rcs": "unknown",
    "sms_over_ims": "unknown",
    "video_calling": "unknown",
    "volte": "unknown",
    "vonr": "unknown",
    "vowifi": "unknown",
    "wifi_calling_roaming": "unknown"
  },
  "display_name": "LineageOS 21403",
  "match": {
    "mccmnc": [
      "21403"
    ],
    "spn": [
      "OpenMovil"
    ]
  },
  "profile_id": "open.21403.df587a8cf5f5",
  "schema_version": 1
}
