{
  "addons": {
    "emergency_calling": {
      "e911_routing_policy": "csprefer",
      "emergency_dial_call_style": "EndPreviousCall"
    },
    "ims": {
      "support_ims_clir_overriding": true
    },
    "network_policy": {
      "display_antenna_limited": true,
      "gcf_sor": true,
      "network_selection_menu_style": "NUMERIC",
      "network_type_capability": "EUR-EUR-GSM-EUR",
      "voice_network_setting_style": "StopNetworkSearchingOnPause"
    },
    "operator_display": {
      "five_g_icon_configuration": [
        "connected_mmwave:5G",
        "connected:5G",
        "not_restricted_rrc_idle:5G",
        "not_restricted_rrc_con:5G"
      ],
      "refer_eons_without_lac": true
    }
  },
  "android_carrier_config": {
    "carrier_volte_available_bool": true,
    "smsToMmsTextThreshold": 10
  },
  "capabilities": {
    "esim": "unknown",
    "ims_conference": "unknown",
    "mms": "supported",
    "rcs": "unknown",
    "sms_over_ims": "unknown",
    "video_calling": "unknown",
    "volte": "supported",
    "vonr": "unknown",
    "vowifi": "unknown",
    "wifi_calling_roaming": "unknown"
  },
  "display_name": "Free Caraibes Guadeloupe",
  "match": {
    "mccmnc": [
      "20815"
    ],
    "spn": [
      "Free Caraibes Guadeloupe"
    ]
  },
  "profile_id": "open.20815.1a61ae1b55c0",
  "schema_version": 1
}
